title,cve_ids,cvss_v3,Risk Score,Detection,Column1,Refs
IBM InfoSphere Information Server XML external injection vulnerability,CVE-2025-12531,7.9,,,2/23 CH - QID Available (386497),https://www.ibm.com/support/pages/node/7249881
IBM Advanced Interactive eXecutive (AIX) Libxml2 Vulnerability,CVE-2025-8732,7,,,2/23 CH - QID Available (330241),https://aix.software.ibm.com/aix/efixes/security/libxml2_advisory10.asc
Red Hat OpenShift Container Platform 4.17 Security Update,CVE-2025-65637,7.5,,,2/23 CH - QID Available (771583),https://access.redhat.com/errata/RHSA-2026:2746
F5 BIG-IP Linux kernel Vulnerability ,CVE-2025-22026,7.3,,,2/23 CH - QID Available (386620),https://my.f5.com/manage/s/article/K000160079
"Gitlab Improper Input Validation Vulnerability (prior to gitlab- 17.1.7,17.2.5,17.3.2)",CVE-2024-8754,8.1,,,2/23 CH - QID Available (386585),https://gitlab.com/gitlab-org/cves/-/blob/master/2024/CVE-2024-8754
