title,cve_ids,cvss_v3,Risk Score,Detection,Column1,Refs
IBM App Connect Enterprise / IBM Integration Bus Apache Commons Lang Denial of Service Vulnerability,CVE-2025-48924,Column1,Column2,Column3,Column4,https://www.ibm.com/support/pages/node/7252694
GitLab Multiple Vulnerabilities,CVE-2024-9183,7.5,,Qualys QID,11/28 CH - QID Available (386123),https://about.gitlab.com/releases/2025/11/26/patch-release-gitlab-18-6-1-released
Red Hat JBoss Enterprise Application Platform Vulnerability,CVE-2025-4949,8.6,,Qualys QID,"11/28 CH - QID Available (6045148, 6045149)","https://access.redhat.com/errata/RHSA-2025:22187
https://access.redhat.com/errata/RHSA-2025:22188"
Red Hat update for bind,CVE-2025-40778,7.9,,Qualys QID,"11/28 CH - QID Available (6045144, 6045150)","https://access.redhat.com/errata/RHSA-2025:22168
https://access.redhat.com/errata/RHSA-2025:22205"
Red Hat update for expat,CVE-2025-59375,8.6,,Qualys QID,11/28 CH - QID Available (6045145),https://access.redhat.com/errata/RHSA-2025:22175
Red Hat update for golang,CVE-2025-47906,7.5,,Qualys QID,11/28 CH - QID Available (6045146),https://access.redhat.com/errata/RHSA-2025:22181
Red Hat update for tigervnc,CVE-2025-62229,7.8,,Qualys QID,11/28 CH - QID Available (6045140),https://access.redhat.com/errata/RHSA-2025:22164
Red Hat update for tigervnc,CVE-2025-62231,7.8,,Qualys QID,11/28 CH - QID Available (6045140),https://access.redhat.com/errata/RHSA-2025:22164
